User Id,Name,Screen Name,Created At,Followers,Following,Favorites,Tweets,Lists,Language,Bio,Location,URL,Timezone,UTC Offset,Verified
979390690600906752,Representative Cindy Polo,CindyPoloFL103,Thu Mar 29 16:11:51 +0000 2018,2539,1619,3259,1905,31,,"Mother | Citizen | Advocate • #notapolitician, but now an Elected Official • Proudly Representing District 103 • Being the Change I wish to see",District 103 - NW Dade & South,https://t.co/zKtyZrzIGH,,,0
116919659,Aaron Regunberg,AaronRegunberg,Wed Feb 24 00:18:27 +0000 2010,3624,769,358,1791,90,,"Fighting for a Rhode Island that works for all of us, not just the rich and well-connected few. Opinions are my own.","Providence, RI",https://t.co/mwEWYZ01oi,,,0
357092583,Jumaane Williams,JumaaneWilliams,Wed Aug 17 20:50:24 +0000 2011,41979,2345,7891,20244,680,,Activist elected official fighting for a more just & equitable NYC. Currently: Public Advocate. Previously: Council Member & Tenant Organizer.  #ItsTime #LetsGo,"New York, NY",https://t.co/JJ57K9nuzO,,,1
15467700,Zephyr Teachout,ZephyrTeachout,Thu Jul 17 13:38:46 +0000 2008,108671,22157,13326,19774,1465,,On book leave from twitter. Root out corruption. Break up corporate monopolies. Recommit to democracy. We are only beginning.,"Clinton, NY",,,,1
881974187589603328,Rep. Anna V. Eskamani 🔨,AnnaForFlorida,Mon Jul 03 20:33:27 +0000 2017,11440,1431,20514,17372,110,,"Orlando native, daughter of immigrants, authentic, and unafraid progressive. Worked at Planned Parenthood, @UCF grad, elected to serve FL HD47. #OnwardWithAnna","Orlando, FL",https://t.co/qXl7VZdsRV,,,0
145094331,Christopher Pearson,SenatorCP,Tue May 18 03:21:03 +0000 2010,4165,2802,2784,5717,118,,"Senator from Chittenden County. Committed to economic, climate, and social justice in Vermont and beyond.","Burlington, VT",https://t.co/w0qrIX1Xom,,,0
1243964484,Ali Dieng,diengali,Tue Mar 05 15:22:30 +0000 2013,1288,802,5470,1709,70,,"Life Long Learner, Love Family & Community - #BTV #VT Elected City Councilor & JOP - Opportunities for everyone, NGOM IS THE MAHDI! Tweets are my own..","BURLINGTON, VERMONT USA",https://t.co/1ndGObkeT0,,,0
35803923,Spectrum,SpectrumVT,Mon Apr 27 17:39:42 +0000 2009,2729,1034,2074,6464,126,,"Spectrum Youth & Family Services is a #VT nonprofit dedicated to providing housing and support services for homeless, at risk, and foster-care youth in Vermont.","Burlington, VT",http://t.co/dZEYjWEl5z,,,0
139731000,arianna jones,ariannaijones,Mon May 03 14:13:34 +0000 2010,6896,2473,3048,163,160,,#bernie2020 comms director / former SVP of PR @revmsg / deputy communications director #bernie2016 / @MSNBC producer / proud @uvmvermont & @nbcuPageProgram alum,"Washington, DC",,,,1
619377190,Dave Zuckerman,DaveZuckermanVT,Tue Jun 26 19:55:37 +0000 2012,5121,4834,3070,2739,108,,"Dave Zuckerman (P/D) LG of Vermont. Bernie Sanders - ""Most Progressive LG in USA"". Co-owns/operates Full Moon Farm with his spouse Rachel Nevitt #dz4vt","Hinesburg, VT",https://t.co/4XHEhkK78q,,,0
16935074,Christine Hallquist,christine4world,Thu Oct 23 20:36:28 +0000 2008,10066,1405,741,3295,146,,"Former candidate for Governor of Vermont, telemark skier, runner, piano player, parent of three amazing children. CEO of Cross Border Power.","Hyde Park, VT",https://t.co/WbgA4pkRrW,,,0
807095,The New York Times,nytimes,Fri Mar 02 20:41:42 +0000 2007,43627651,898,18241,363616,199940,,"""The Weekly"" is our new TV series. Episodes air Sundays at 10 p.m. on FX and on Hulu the next day. 

News tips? Share them here: https://t.co/ghL9OoYKMM",New York City,http://t.co/ahvuWqicF9,,,1
9763482,New York Daily News,NYDailyNews,Mon Oct 29 00:07:35 +0000 2007,700713,1648,1562,252990,10837,,"New York's Hometown Paper. 🍎 Breaking news, national (with a NY lens), politics, sports and entertainment in NYC & beyond |  About Us https://t.co/reU6GpyHJd",New York City  /  fb.com/nydailynews,https://t.co/9YU0vkZdRH,,,1
274440617,Ammar Campa-Najjar,ACampaNajjar,Wed Mar 30 09:12:37 +0000 2011,32040,1712,3238,2326,323,,"Running for Congress (CA-50). Small business owner. Former federal official (DOL). Son of a union mom, community college & SDSU alum.","San Diego, CA",https://t.co/9BWVvI28NQ,,,1
65576332,Her Campus,HerCampus,Fri Aug 14 06:07:11 +0000 2009,40627,2818,9036,70431,745,,The BFF who’s just as likely to check your cover letter as she is to chug rosé. Blood type: iced coffee. Status: probably napping. Pizza & puppy enthusiast.,"Boston, MA",https://t.co/WkZJ5l2pVF,,,1
322990625,UMD Student Government,UMDSGA,Fri Jun 24 02:29:08 +0000 2011,3363,699,758,4388,61,,Student Government Association @UofMaryland | A voice for all Terps | Meetings every Wednesday @ 6PM in the Charles Carroll room in Stamp,"College Park, Maryland",https://t.co/es98YViMsS,,,0
1309287014,David Garcia,dg4az,Thu Mar 28 03:22:10 +0000 2013,11922,1308,1876,3154,163,,"Husband to Lori, father to Lola & Olivia. I'm a teacher, veteran & I'm running for Governor to fight for AZ working families. https://t.co/hcUEVxkazF","Phoenix, Arizona",https://t.co/hcUEVx2zI7,,,1
2447986668,NYTLive,NYTLive,Wed Apr 16 20:38:46 +0000 2014,8275,1061,2050,5831,138,,"Hosted by senior editors of The New York Times, NYTLive offers live events including world-class conferences, TimesTalks, Get With The Times and custom events.","New York, NY",https://t.co/yLEt5y7nZx,,,1
499109830,Rep. Peter Welch,WelchForVT,Tue Feb 21 19:48:49 +0000 2012,1448,316,1,512,124,,Welcome to the campaign account for Rep. Peter Welch. Peter has been a champion for working Vermonters throughout his distinguished career of public service.,Vermont,https://t.co/ieHl5KMeOs,,,1
15675138,CSPAN,cspan,Thu Jul 31 14:29:10 +0000 2008,1955622,8860,1441,40070,13864,,Capitol Hill. The White House. National Politics.,"Washington, D.C.",https://t.co/L3A4afzX6T,,,1
309354920,John Wagner,WPJohnWagner,Wed Jun 01 23:33:34 +0000 2011,21648,4650,181,10830,935,,"Washington Post national political breaking news reporter. Previously White House; 2016 campaigns of Sanders, Clinton; Md statehouse. Stanford grad. STL native.","Washington, DC",,,,1
165791468,SocialSecurityWorks,SSWorks,Mon Jul 12 15:09:48 +0000 2010,24386,6846,4282,19898,452,,We're fighting to address the retirement income crisis by protecting and expanding our Social Security system.,"Washington, DC",http://t.co/oWaMKWm531,,,1
43638469,Ben Jealous,BenJealous,Sun May 31 04:07:23 +0000 2009,105140,10427,16031,14837,1700,,Father & Son. Brother & Friend. Entrepreneur & Advocate.,"Maryland, USA",,,,1
15754281,USA TODAY,USATODAY,Wed Aug 06 19:55:31 +0000 2008,3814618,612,1992,289108,33407,,The latest news and most interesting stories from USA TODAY. News that's meant to be shared.,"USA TODAY HQ, McLean, Va.",http://t.co/7xDl0vVHSt,,,1
7998482,USA TODAY Politics,usatodayDC,Mon Aug 06 17:57:26 +0000 2007,210910,768,80,41444,1394,,All the latest politics and election news from USA TODAY's Washington bureau and politics team.,"Washington, D.C.",https://t.co/2eHjV3emk3,,,1
14717197,Talking Points Memo,TPM,Fri May 09 19:46:43 +0000 2008,277672,619,115,145454,9382,,"Breaking news and analysis from the TPM team. 

“I’ll leave that to the geniuses at Talking Points Memo."" —Tucker Carlson.",NY & DC,http://t.co/ZyHPG61Yqv,,,1
426802833,AP Politics,AP_Politics,Fri Dec 02 18:26:10 +0000 2011,358481,617,15,77760,5830,,"Highlights from AP's coverage of U.S. politics and government in words, photos and video. Managed by the Washington bureau. https://t.co/lTcEv1VGoB","Washington, D.C.",https://t.co/oS489jIdWx,,,1
920024697802248192,Our Revolution SC,OurRevolutionSC,Mon Oct 16 20:32:36 +0000 2017,403,739,951,1315,8,,"We are here to revitalize American democracy, empower progressive leaders, and elevate the political consciousness.","South Carolina, USA",https://t.co/ZCaZPioRVr,,,0
102071743,Governor Gretchen Whitmer,GovWhitmer,Tue Jan 05 14:15:29 +0000 2010,76294,446,1209,4799,688,,49th Governor of Michigan. Proud mom.,"East Lansing, MI",https://t.co/8vKJCSSDGB,,,1
821665941721382913,Liz Watson,LizSchoffWatson,Wed Jan 18 10:30:01 +0000 2017,6142,3025,2670,3272,102,,ED of Congressional Progressive Caucus Center & Progressive Caucus Action Fund. This is my personal account.,"Washington, DC",,,,0
19539716,Friends of the Earth,foe_us,Mon Jan 26 15:39:13 +0000 2009,157086,1869,1828,47739,2761,,"Friends of the Earth (Action), Inc. defends the environment and champions a healthy and just world.","Washington, D.C.",https://t.co/e2MV3qunOo,,,1
753623149929869312,Our Revolution,OurRevolution,Thu Jul 14 16:12:15 +0000 2016,116384,1394,1131,9341,1175,,Campaigns end. Revolutions endure. This is the official account of Our Revolution. Text PROGRESS to 83224 to get involved.,,https://t.co/izXsPo2aL7,,,1
552983877,act.tv,actdottv,Fri Apr 13 18:15:09 +0000 2012,10624,2631,12240,28105,226,,Rise up and Resist! Your home for movement-oriented video from a network of progressive activists. Join us to #ResistTrump and fight for a political revolution.,,https://t.co/SLEEqlaq9v,,,0
42958829,CBS Evening News,CBSEveningNews,Wed May 27 20:08:03 +0000 2009,308325,1548,1142,97552,4205,,"The official account of The CBS Evening News, the longest running evening newscast.",📺 6:30pm ET,https://t.co/Mm7FlsMteV,,,1
414436134,Barbara Lee,BLeeForCongress,Thu Nov 17 01:52:10 +0000 2011,11990,803,136,4850,235,,"Thanks to voters, Barbara Lee represents CA's new 13th Congressional District. This is her campaign account.","Oakland, CA",http://t.co/jg0RvnVAeG,,,1
887704019296276482,J.D. Scholten,JDScholten,Wed Jul 19 16:01:45 +0000 2017,107499,97901,17457,4197,468,,Iowa born and raised. Former ⚾️ player & 2018 Democratic candidate for Congress against Steve King in #IA04.      Board member of @_OneCountry_,"POB 3531 Sioux City, IA 51102",https://t.co/omZPq72UiX,,,0
816819836105949184,Tony Evers,Tony4WI,Thu Jan 05 01:33:19 +0000 2017,29548,1209,304,1866,249,,"Governor of Wisconsin. Former WI state schools Superintendent. Father, Educator, Euchre enthusiast, life-long Badger. Plymouth Progressive.","Wisconsin, USA",https://t.co/EyMcMIzFgs,,,1
16370091,Working Families Party,WorkingFamilies,Fri Sep 19 20:51:46 +0000 2008,37852,4994,5318,15321,851,,"The progressive party, fighting to build an America that works for everyone, not just the wealthy and well-connected.",,https://t.co/rYXRy0xxDy,,,1
600422073,Jared Polis,PolisForCO,Tue Jun 05 19:10:00 +0000 2012,10576,717,392,2135,167,,"Independent leader, turning bold ideas into real results. Running for #COGov for energy independence, education, universal health care, and an inclusive economy","Littleton, CO",https://t.co/gQ80sgNioX,,,1
263269829,Colorado Dems,coloradodems,Wed Mar 09 18:38:31 +0000 2011,8434,663,599,6195,269,,Official Twitter account of the Colorado Democratic Party.,Colorado,https://t.co/kJheOnCxiP,,,1
72717049,NV Dems,nvdems,Wed Sep 09 00:41:36 +0000 2009,12454,1495,1325,8608,340,,The Nevada State Democratic Party fights for progress in the Silver State.,Nevada,https://t.co/rNWYZgDwS8,,,1
1426645165,Bustle,bustle,Mon May 13 23:52:12 +0000 2013,93042,2260,11339,51407,1494,,"For & by women who are moving forward as fast as you are 💁‍♀️

Subscribe to the Bustle Huddle podcast ➡️ https://t.co/HuFjFQ8pc9","New York, NY",http://t.co/Vy51JjxbWM,,,1
4749863113,Jacky Rosen,RosenforNevada,Tue Jan 12 20:33:06 +0000 2016,36809,592,166,2197,474,,Campaign account for U.S. Senator Jacky Rosen. Ready to fight for Nevada's hardworking families.,"Henderson, NV",https://t.co/rPM1vxxJFb,,,1
2369658618,Times of San Diego,TimesofSanDiego,Mon Mar 03 01:56:51 +0000 2014,3344,380,107,14301,136,,"Independent website with the latest news, business, sports and other information for the greater San Diego area.","San Diego, CA",http://t.co/raLO8ME97d,,,0
14148802,San Diego Union-Tribune,sdut,Fri Mar 14 19:29:04 +0000 2008,178832,130,2598,102645,3055,,"The San Diego Union-Tribune, the region's leading news source since 1868. Follow our journalists, too: https://t.co/bahQMYf2zJ","San Diego, CA",https://t.co/Sr8qZVoQNl,,,1
1412058266,UNITE HERE Local 30,UNITEHERE30,Wed May 08 05:50:21 +0000 2013,1305,822,1471,2779,38,,"Local 30 represents over 6,000 hard working hotel, food service, airport and gaming workers throughout San Diego County.","San Diego, CA",https://t.co/kc2Ysdma8N,,,0
85858178,Vermont AG Donovan,VTAttorneyGen,Wed Oct 28 16:49:36 +0000 2009,2304,763,78,1077,75,,"Official Twitter account for Thomas J Donovan Jr., Vermont Attorney General.",Vermont,https://t.co/az53F7HV1L,,,0
17446277,Orlando Weekly,OrlandoWeekly,Mon Nov 17 17:53:29 +0000 2008,139189,2229,1432,31989,1118,,"Orlando Weekly, published every Wednesday, is Central Florida’s alternative source for news, views, arts and entertainment.","Orlando, FL",http://t.co/sSJ2CZLSQj,,,0
837409894294749185,Chris King,ChrisKingFL,Thu Mar 02 21:10:51 +0000 2017,17511,608,632,2231,130,,"Married to my high school sweetheart. Proud father of Charlie, Mary Grace, and Luke. CEO of Elevation Financial Group. 2018 Democratic nominee for Lt. Governor.",Florida,,,,1
90642314,Vermont Democrats,VTdems,Tue Nov 17 14:40:29 +0000 2009,4819,1251,375,2881,195,,"The Vermont Democratic Party — building a stronger, brighter future for all Vermonters.",Vermont,https://t.co/3OEUwqNuQs,,,1
214112621,ATTN:,attn,Wed Nov 10 16:05:45 +0000 2010,112530,478,3995,27047,1901,,Stories worth your ATTN: | P.S. It's pronounced attention.,USA,https://t.co/9u6zfQoLLU,,,1
811377,Reddit,reddit,Mon Mar 05 03:38:33 +0000 2007,627683,1024,9540,87692,7230,,The front page of the internet  •  Get the app: https://t.co/lShIcqSOWi • Interested in doing an AMA? Visit https://t.co/6EXpZZ4kL5,"San Francisco, CA",https://t.co/M0uRGy9Hkg,,,1
14957147,The Young Turks,TheYoungTurks,Fri May 30 19:07:59 +0000 2008,367791,10611,11378,84755,6031,,Hosted by @CenkUygur & @AnaKasparian. Watch #TYTLive weeknights at 6pm eastern  https://t.co/IiyyhHmpyp,"Los Angeles, CA",https://t.co/2udwUBlnLX,,,1
361342191,OutFrontCNN,OutFrontCNN,Wed Aug 24 16:55:20 +0000 2011,292825,726,167,43926,1809,,"Smart and entertaining, @ErinBurnett is always OutFront of the news. Erin Burnett OutFront airs weeknights at 7pm ET on @CNN and on @CNNi Saturdays & Sundays.","New York, NY ",https://t.co/ohYB7WijK3,,,1
24190981,Teen Vogue,TeenVogue,Fri Mar 13 15:38:45 +0000 2009,3346985,2536,14517,112460,11701,,The young person's guide to conquering (and saving) the world ✨👊🏾,,https://t.co/JlGpMlgJcC,,,1
4230994853,Rights & Democracy,RightsNH,Fri Nov 20 02:07:51 +0000 2015,1269,1163,1861,2124,23,,Join our strong and vibrant people's movement that is holding elected officials accountable to the needs of working Granite Staters. #TogetherWeWin #NHPolitics,"New Hampshire, USA",https://t.co/VrGzsjetp5,,,0
353272992,SiriusXM Progress,SXMProgress,Thu Aug 11 20:31:25 +0000 2011,11756,630,5738,19139,197,,SiriusXM Progress 127 - THE Home Of The Resistance! #Resist #GetWoke | Opinions here do not represent those of SiriusXM,New York,https://t.co/dHKsJlwvTO,,,1
2977482676,Shannon Jackson,shannondjackson,Wed Jan 14 01:40:18 +0000 2015,365,307,1103,127,10,,,"Washington, D.C.",,,,0
2861151808,Christine Pellegrino,cpellegrino1221,Tue Nov 04 18:23:44 +0000 2014,4175,4994,18197,32636,159,,"Mom, teacher, Environmental protection, women’s rights, fmr Assemblywoman, fighter for Labor.  #StrongfortheSouthShore","Long Island, NY ",,,,0
3946773623,VT Sec. of State,VermontSOS,Tue Oct 13 13:25:15 +0000 2015,3170,397,2321,3863,90,,"News & updates from Sec. of State Jim Condos’ office about elections, professional regulation, business registration & state archives. Tweets managed by staff.","Vermont, USA",http://t.co/QhgivutGK8,,,1
533302249,TJ Donovan,TJforVermont,Thu Mar 22 17:02:29 +0000 2012,2753,569,47,1441,87,,"Currently serves as Attorney General for State of Vermont, Husband and Father, Working to Do More For Vermont","Burlington, Vermont",,,,1
29450962,John Lewis,repjohnlewis,Tue Apr 07 13:49:52 +0000 2009,1066567,145,1840,1937,5865,,"Congressman, Georgia's Fifth Congressional District","Atlanta, GA",http://t.co/jkhd3kZYNd,,,1
15458694,HuffPost Politics,HuffPostPol,Wed Jul 16 19:45:46 +0000 2008,1423409,8883,108,298695,16954,,The latest political news from HuffPost's politics team.,"Washington, D.C.",https://t.co/tn6MKaH6mv,,,1
815733290955112448,Rep. Pramila Jayapal,RepJayapal,Mon Jan 02 01:35:46 +0000 2017,152844,2652,9467,15282,1734,,"Congresswoman & lifelong organizer. Proudly serving WA-07. Co-Chair of @USProgressives, Member of @HouseJudiciary, @EdLaborCmte and @HouseBudgetDems.","Seattle, WA",https://t.co/bFjm8t92H0,,,1
783792992,Ilhan Omar,IlhanMN,Mon Aug 27 04:21:41 +0000 2012,1108639,1260,15305,11604,4000,,"Mom, Refugee, Intersectional Feminist, 2017 Top Angler of the Governor's Fishing Opener and Congresswoman for #MN05. Join me 👇🏽",Minneapolis,https://t.co/GpQErcEp3y,,,1
36371489,Vermont Edition,vermontedition,Wed Apr 29 14:36:21 +0000 2009,13027,2358,507,6421,263,,VPR's daily regional news magazine,Vermont,http://t.co/f4XM9PmrCv,,,1
116850607,Win Without War,WinWithoutWar,Tue Feb 23 19:32:14 +0000 2010,12053,1576,14255,27106,304,,We're a national leader in the fight to promote a more progressive national security strategy.,"Washington, D.C.",http://t.co/g1rCjBNp73,,,1
800707492346925056,Axios,axios,Mon Nov 21 14:28:37 +0000 2016,278394,828,470,50312,4957,,"Smart Brevity worthy of people's time, attention and trust. 

Visit our stream: https://t.co/MOsBGwib0S

Subscribe to our newsletters: https://t.co/hi21XepUhE",,https://t.co/A2aCI9Z3fA,,,1
14693499,The Post and Courier,postandcourier,Wed May 07 23:40:04 +0000 2008,133186,331,3840,137098,1689,,"We’re the oldest, largest and best news source in South Carolina, based out of Charleston. Find us: 💻📲📰","Charleston, SC",https://t.co/4b83Fbdfyr,,,1
268476335,Steven Greenhouse,greenhousenyt,Fri Mar 18 21:19:23 +0000 2011,45217,311,3035,45194,1773,,"Former New York Times Labor Reporter—Author of ""Beaten Down, Worked Up: The Past, Present & Future of American Labor"" Publication 8/6/19 https://t.co/gDnCthaqSM",New York,http://t.co/lNhhWnKjY8,,,0
22706629,United Teachers Los Angeles,UTLAnow,Wed Mar 04 00:29:42 +0000 2009,21044,797,3196,7425,254,,"🍎 UTLA is 35,000 educators in Los Angeles dedicated to quality public education. #UTLAStrong #WeArePublicSchools #KidsFirst",Los Angeles,https://t.co/1nFBwMQXB7,,,0
56767953,California Teachers Association,WeAreCTA,Tue Jul 14 18:11:22 +0000 2009,23448,7047,21301,28763,566,,"CTA is 325,000 educators in California’s public schools and colleges. Powerful and passionate advocate for students, public ed & the profession. ✏️ 📚 #WeAreCTA",California,https://t.co/IZvOPG7Fcn,,,1
1670686340,Benedict College,BenedictEDU,Wed Aug 14 14:44:42 +0000 2013,4363,837,1671,2945,57,,"Founded in 1870, Benedict College is a private, co-educational liberal arts institution and currently has over 2,155 students. #BenedictCollege","Columbia, SC",https://t.co/jPcqEtbgKX,,,0
964290677013143552,Rise Up Retail,riseupretail,Fri Feb 16 00:09:47 +0000 2018,1664,618,940,909,19,,"We are a movement of retail workers fighting for better pay, fair hours, and respect. #RiseUpRetail",,,,,0
107120201,MSNBC Public Relations,MSNBCPR,Thu Jan 21 16:18:30 +0000 2010,11931,583,107,6786,318,,"The official Twitter feed of @MSNBC Public Relations. Follow us for the latest news, exclusives & a behind-the-scenes look at MSNBC.",,https://t.co/hmQONSQz0v,,,1
519072324,Carmen Yulín Cruz,CarmenYulinCruz,Fri Mar 09 01:43:23 +0000 2012,251888,549,14959,41801,1014,,Cuenta Oficial de Carmen Yulin Cruz,San Juan,https://t.co/jB4HFHdQ3M,,,1
82167518,Alex Seitz-Wald,aseitzwald,Tue Oct 13 19:13:32 +0000 2009,55200,3244,9564,31486,2016,,"Political reporter for @NBCNews covering 2020 because 2016 didn't kill me. | Tips, questions, death threats to: alexander.seitz-wald@nbcuni.com","Washington, DC",,,,1
32309662,Danny Glover,mrdannyglover,Fri Apr 17 04:40:03 +0000 2009,1284085,1143,2136,3619,7922,,"Actor, Director, Producer, Political Activist",San Francisco,https://t.co/Bnnyr2bROc,,,1
71876190,Danny DeVito,DannyDeVito,Sat Sep 05 19:44:48 +0000 2009,4021091,18,141,7288,22291,,"I'm an actor, director and producer.",Los Angeles,http://t.co/9l5Y5m9YwB,,,1
64397992,Brooklyn College,BklynCollege411,Mon Aug 10 13:06:45 +0000 2009,8752,711,7001,6631,198,,Brooklyn College is an innovative liberal arts institution with a history of academic excellence for more than 80 years.,2900 Bedford Avenue,https://t.co/dvZhpjl2MU,,,1
14098960,Tim Tagaris,ttagaris,Sat Mar 08 04:38:19 +0000 2008,8649,511,260,36,265,,@Aisle518 - @BernieSanders - #GoCubsGo and #NeverTweet,,,,,1
3141672447,People for Bernie,People4Bernie,Mon Apr 06 19:50:36 +0000 2015,119127,1438,28693,97561,1285,,"We are activists and organizers building a broad, effective movement for democratic change. Welcome to the political revolution.

Internet Mom of #FeelTheBern.",United States,https://t.co/TvBDXQ42AW,,,1
227409764,YDSA,YDSA_,Thu Dec 16 19:34:35 +0000 2010,30210,1082,5752,5699,284,,"Student section of @demsocialists. Organizing students, workers, faculty and staff at campuses across the country. Join us!",United States,https://t.co/hB08ohoEKz,,,1
252751061,TicToc by Bloomberg,tictoc,Tue Feb 15 20:50:58 +0000 2011,714886,1218,753,139548,5873,,Global news for the world we live in now.,,https://t.co/O0sSpXABY4,,,1
7868832,Faiz,fshakir,Wed Aug 01 03:40:39 +0000 2007,35935,2170,1156,12343,566,,Campaign manager for @BernieSanders. Views expressed here are my own. Email: faiz@berniesanders.com,D.C.,https://t.co/JeW2BZe5z7,,,1
71120500,Grace Rauh,gracerauh,Thu Sep 03 00:17:21 +0000 2009,16555,1921,8118,15235,443,,NY1 political reporter & host of NY1’s podcast “Off Topic/On Politics.” Email tips to grace.rauh@charter.com,,https://t.co/ysS0vxyiU6,,,1
17977273,UE,ueunion,Mon Dec 08 23:32:22 +0000 2008,1908,558,292,2035,26,,The Members Run This Union,"Pittsburgh, PA",http://t.co/iTdNS6wyIQ,,,0
25466022,David Klion🔥,DavidKlion,Fri Mar 20 05:23:13 +0000 2009,46137,4456,78958,31932,730,,"News Editor @JewishCurrents, writer @thenation and elsewhere, ""ubiquitous Twitter pundit"" per New York Magazine. KLEE-on, from the Russian Клионский",Brooklyn,https://t.co/zS085YO2zL,,,1
33805522,Bhaskar Sunkara,sunraysunray,Tue Apr 21 04:07:04 +0000 2009,48693,1314,4013,25903,778,,"founder @jacobinmag, columnist @guardianus, hype man @demsocialists, The Socialist Manifesto: https://t.co/SHzuyEVtWq #NoMiddleGround","New York, NY",https://t.co/DlAoi61JOq,,,1
7313362,Chicago Tribune,chicagotribune,Sat Jul 07 14:10:07 +0000 2007,1085147,408,395,183869,11689,,Breaking news since 1847.,"Chicago, IL",https://t.co/gaVbUBEf0t,,,1
16625082,Ryan Nobles,ryanobles,Tue Oct 07 03:16:20 +0000 2008,32238,1697,2563,34442,891,,@CNN Washington Correspondent | Husband and Dad | Following @BernieSanders campaign for President (and other things) | #lgm,"Washington, D.C.",,,,1
17017636,John Cusack,johncusack,Tue Oct 28 08:16:13 +0000 2008,1622366,1051,82,70051,15122,,Apocalyptic shit disturber and elephant trainer,USA,https://t.co/ZSpOvzZOB1,,,1
1041044041,Georgia Parke,nationalparke,Fri Dec 28 01:24:48 +0000 2012,6644,1471,24845,2916,141,,senior social media strategist @BernieSanders / go Duke,DC,,,,0
2918099366,Sarah Fili,SarahFiliKETV,Thu Dec 04 02:16:09 +0000 2014,2537,783,7548,11062,47,,Reporter @KETV. @NEWesleyan Alum. Omaha native. My tweets are my own. Let’s chat! sfili@hearst.com.,"Omaha, NE",https://t.co/3KA1TzYBTg,,,1
16347171,Nick Weig,tbweig,Thu Sep 18 14:22:28 +0000 2008,831,711,1050,8896,45,,"Father, Husband, @cbs2iowa &  @fox28iowa Political Reporter 📺, Storm Chaser🌪, Hawkeyes🏈🏀 & Cubs⚾ fan. RT not endorsements. Opinions are my own.","Marion, IA",https://t.co/dCkWnImx9G,,,1
17164352,Clay Masters,Clay_Masters,Tue Nov 04 18:57:35 +0000 2008,6361,996,8805,16997,289,,Mornings & political reporting @IowaPublicRadio | #CaucusLand co-host | gotta get behind the mule,"Des Moines, IA",https://t.co/8FijM4NvRc,,,1
1132012321,Daniella Díaz 🤠,DaniellaMicaela,Tue Jan 29 20:05:07 +0000 2013,22370,1109,24415,2368,586,,"@CNN 2020 embed covering the New Hampshire primary (and Sen. Elizabeth Warren). Latina from McAllen, TX. @UTRGV grad. I'm better on Instagram. ⬇️⬇️⬇️","Soon: Manchester, NH",https://t.co/Vh4maEPRxW,,,1
2940964728,Iowa Starting Line,IAStartingLine,Tue Dec 23 16:50:35 +0000 2014,19776,1991,5254,34273,504,,Your home for Iowa Caucus and Iowa politics news and analysis. Founded in 2015 by former IA Dem staffer @patrynard.,,https://t.co/DpEAYnDMWv,,,0
24439201,James Hohmann,jameshohmann,Sat Mar 14 22:11:59 +0000 2009,50904,4089,24200,39437,1630,,National Political Correspondent for The Washington Post || Author of The Daily 202 || Anchor of @PowerPost || Minnesotan || James.Hohmann@washpost.com,D.C.,https://t.co/Fhx3RiEpKX,,,1
229248547,SEIU Nevada,SEIU1107,Tue Dec 21 22:41:52 +0000 2010,2468,915,2043,3989,70,,"The official account of the largest movement of healthcare & public workers in Nevada. Service Employees International Union Nevada Local 1107, https://t.co/rY91PEstdF","Las Vegas, NV",https://t.co/rY91PEstdF,,,0
251379913,Neil Barofsky,neilbarofsky,Sun Feb 13 01:09:05 +0000 2011,14655,190,404,5056,654,,"Partner at Jenner & Block (attorney advertising, prior results do not guarantee a similar outcome). Former IG for TARP, author of NY Times best seller Bailout.",NYC,https://t.co/8D0nx1rTqa,,,0
19546942,Refinery29,Refinery29,Mon Jan 26 17:58:09 +0000 2009,1323589,2151,5140,93009,9853,,"The catalyst for women to feel, see, and claim their power.💪 We cover news, fashion, beauty, entertainment, wellness, and more. 📝","New York, NY",https://t.co/IV6feOqSCz,,,1
878403801987727360,Amy Vilela,amy4thepeople,Sat Jun 24 00:06:01 +0000 2017,20472,1025,8340,3525,146,,"I am a mother, business woman, military spouse, and a bold Progressive fighting to put #PeopleOverProfit",,https://t.co/AOKav088Tx,,,1
