User Id,Name,Screen Name,Created At,Followers,Following,Favorites,Tweets,Lists,Language,Bio,Location,URL,Timezone,UTC Offset,Verified
978782184,Emerson Polling,EmersonPolling,Thu Nov 29 17:28:06 +0000 2012,8830,47,152,1588,251,,The official Twitter account of Emerson Polling. Administering and analyzing election and public opinion polls that affect the nation.,"Boston, MA",https://t.co/xaG0GHF3oS,,,0
3044739166,Sara Nelson,FlyingWithSara,Wed Feb 18 19:27:05 +0000 2015,15573,1987,6901,4582,95,,"President of the Association of Flight Attendants-CWA @afa_cwa, representing 50K at 20 airlines. Proud Flight Attendant & Passionate Union Activist since 1996.","Washington, DC",https://t.co/eaaNGLEr1p,,,1
937422446323314688,Elex Michaelson,Elex_Michaelson,Sun Dec 03 20:45:02 +0000 2017,4628,3554,2199,6847,51,,Co-anchor of @foxla news at 5PM & 10PM & host of the political show “The Issue Is:” Fridays at 10:30PM in L.A. & Saturdays at 6:30AM on @KTVU,"Los Angeles, CA",https://t.co/qUiWXZBqfh,,,1
14326250,Carolyn Said,CSaid,Mon Apr 07 19:47:22 +0000 2008,5750,2308,2614,4840,345,,"Business/tech reporter at @SFChronicle, @SFGate. I cover disruptive companies.",San Francisco Bay Area,https://t.co/Mro3eTcjrl,,,1
1017883562450849794,Gig Workers Rising,GigWorkersRise,Fri Jul 13 21:28:47 +0000 2018,2464,210,444,407,22,,"Gig Workers Rising is a community of app and platform workers organizing for better wages, working conditions and jobs.",,https://t.co/rYGKXkR3CT,,,0
429227921,Cenk Uygur,cenkuygur,Mon Dec 05 18:27:28 +0000 2011,383519,987,3306,22891,4790,,Host of @TheYoungTurks the largest online news show in the world. Founder & CEO of @TYT,Los Angeles,https://t.co/Gm9qQzoCUk,,,1
13657922,Des Moines Register,DMRegister,Tue Feb 19 04:56:13 +0000 2008,153771,5017,1051,99406,2332,,The news Iowans have depended upon since 1849. Winner of 17 Pulitzer Prizes. Support local journalism by subscribing at https://t.co/M3wA9tGwwF.,"Des Moines, Iowa, USA",https://t.co/l1zKlTUG8R,,,1
158414847,The Daily Show,TheDailyShow,Tue Jun 22 16:41:05 +0000 2010,7951128,531,1274,18985,37020,,Trevor Noah & The World’s Fakest News Team. Weeknights 11/10c @ComedyCentral. Tickets: https://t.co/otjFIiMtNU,,https://t.co/BAakBFaEGx,,,1
14695985,SEIU,SEIU,Thu May 08 04:08:06 +0000 2008,87330,11884,5181,45502,2210,,"Official account of the Service Employees International Union, a leading voice for labor & change for working people. Union #1u Join us: https://t.co/fibKyNAilp","U.S., Canada, Puerto Rico",https://t.co/cqohIfQC5Y,,,1
175516377,Misty Rebik,mistyrebik,Fri Aug 06 20:44:42 +0000 2010,1407,1101,4167,1903,37,,Iowan. Organizer. Political most of the time | Iowa State Director @BernieSanders 2020,"Des Moines, IA",,,,0
74829020,Machinists Union,MachinistsUnion,Wed Sep 16 20:28:33 +0000 2009,18699,1927,4293,15675,342,,"The International Association of Machinists & Aerospace Workers. 600,000 people making North America move. Stay in touch: https://t.co/gcgPb2FbNc",U.S. & Canada,,,,1
383647766,Greg Krieg,GregJKrieg,Sun Oct 02 07:52:13 +0000 2011,11032,3152,6203,44237,407,,"@CNNPolitics reporter, covering the left. Rangers, Jets/Mets/Nets and SPURS — all, presumably, ‘til I die. If you must: Gregory.Krieg@turner.com.","Brooklyn, NY",,,,1
22451908,Francesca Chambers,fran_chambers,Mon Mar 02 04:43:46 +0000 2009,20951,3150,1748,8157,713,,White House Correspondent for @DailyMail; covered Dems on the road to the WH in 2016 & now 2020; President Trump once said I'm like a machine gun with questions,"Washington, DC",http://t.co/kGyZ8yvTUj,,,1
18697888,Ruby Cramer,rubycramer,Tue Jan 06 22:03:27 +0000 2009,44273,2748,4221,30205,1458,,@buzzfeednews political reporter covering democrats. used to follow Hillary Clinton around the country. eastern shore of MD native. human.,"Brooklyn, NY",https://t.co/K3wynYQN2n,,,1
413401171,Ryan Bennett,174Steamfitter,Tue Nov 15 21:00:04 +0000 2011,325,408,533,682,13,,Providing West MI with a quality plumbing and mechanical workforce since 1891.,Coopersville MI,http://t.co/aOEnSH032Z,,,0
16868756,Dan Diamond,ddiamond,Mon Oct 20 15:24:07 +0000 2008,105243,965,47089,54622,2832,,I write @POLITICO Pulse — the morning briefing on health care politics and policy — and host the PULSE CHECK podcast. Got tips? DM me for Signal.,"Washington, D.C.",https://t.co/7QYKGBnpyX,,,1
16950628,Wendell Potter,wendellpotter,Fri Oct 24 15:09:46 +0000 2008,11497,2250,1349,4011,569,,"President, @BizhealthPol; Founder of @TarbellOrg; Host of The Potter Report podcast; Author of Deadly Spin and Nation on the Take.","Philadelphia, PA",https://t.co/uDjZ5jHPa3,,,1
1205855952,Radhya Almutawakel,RAlmutawakel,Thu Feb 21 19:58:41 +0000 2013,12676,628,3448,2836,75,,Chairperson of Mwatana for Human Rights @mwatanaar @mwatanaen,Sana'a Yemen,https://t.co/IR5xzRgoxn,,,1
627441683,UFCW Local 400,UFCW400,Thu Jul 05 14:44:20 +0000 2012,3072,2361,3220,7781,71,,"The United Food and Commercial Workers Local 400 represents workers in OH, KY, TN, WV, VA, MD and DC.","Landover, Maryland",http://t.co/Bdo7PJo1SO,,,0
216747924,Shaquille Brewster,shaqbrewster,Wed Nov 17 16:16:36 +0000 2010,6144,1815,5811,11636,252,,@NBCNews Politics | @HowardU Alum| Journalist | Political Junkie | Diehard Suffering @nyknicks Fan| Philippians 4:13 | #DontBelieveMeJustWatch #RoadWarrior,"Chicago, IL",https://t.co/TouDVeULbs,,,1
71349174,CNN Communications,CNNPR,Thu Sep 03 20:21:30 +0000 2009,137821,664,1222,24566,2472,,"Tweets from the @CNN Communications team with the latest news, announcements and a behind-the-scenes look at CNN Worldwide. 
#FactsFirst 🍎",,https://t.co/rDwkB846Cr,,,1
800942537083068416,Women's March,womensmarch,Tue Nov 22 06:02:36 +0000 2016,638048,707,20543,25694,4059,,Organizing for the #WomensAgenda: A federal policy platform created by women and for ALL people. It’s a roadmap for our movements in 2019 and beyond.,"Washington, D.C.",https://t.co/zTyvsU8gUv,,,1
152142811,Noticias Telemundo,TelemundoNews,Sat Jun 05 05:22:50 +0000 2010,687286,862,362,126553,2784,,"Noticias del 🌎 y de nuestra comunidad, #LasCosasComoSon",United States,https://t.co/9DyssB93b6,,,1
410249471,UltraViolet,UltraViolet,Fri Nov 11 21:06:18 +0000 2011,33213,7394,8068,19096,750,,Equality at a higher frequency,United States,https://t.co/lft4oV91lK,,,1
27187343,Linda Sarsour,lsarsour,Sat Mar 28 05:42:36 +0000 2009,301530,2953,5804,93590,3272,,"Palestinian-American-Muslim, born and raised Brooklyn, organizer, civil rights activist, every Islamophobe’s worst nightmare. Booking: Sarsour.Speaks@gmail.com","Brooklyn, NY",https://t.co/aPwnsHJeGj,,,1
13393052,ACLU,ACLU,Tue Feb 12 16:27:34 +0000 2008,1625771,5671,19677,46088,15411,,"The ACLU is a nonprofit, nonpartisan, legal and advocacy 501(c)(4) organization. Visit our site for more about us and our affiliated org, the ACLU Foundation.",All 50 states,https://t.co/AF1gbNeaRA,,,1
979100442,Ben Cohen,YoBenCohen,Thu Nov 29 20:33:17 +0000 2012,17384,4520,1239,4581,350,,Co-Founder of Ben & Jerry's Ice Cream; Working to Amend the Constitution and #GetMoneyOut of Politics.,,http://t.co/B2Ohy1x0,,,1
618300542,Susan Sarandon,SusanSarandon,Mon Jun 25 18:01:07 +0000 2012,630327,529,6124,8965,3631,,Mother | Activist | Actress,"New York, NY",https://t.co/M4hzXfwhwD,,,1
63876208,Yong Jung Cho,YongJungC,Sat Aug 08 01:40:23 +0000 2009,2571,1046,2383,2954,49,,"tweets about America, politics, protests and my people.","Washington, DC",,,,0
702867858729017344,Eduardo Meléndez,cronicavisual,Thu Feb 25 14:48:51 +0000 2016,105,226,1371,1048,0,,"I make photos, sometimes they make the news. 30something millenial fighting for survival. I'm building a time machine. Twits son bilingües.",Eternity,,,,0
883146775,John Delaney,jkdelaney,Mon Oct 15 21:18:06 +0000 2012,395,1407,97,569,5,,"Environmental publicist, writer, birder, amateur astronomer, guitar player, and husband","New York, New York, USA",,,,0
3308239586,#ReplaceIMPACT🌹,Uncle__Jazz,Thu Aug 06 23:07:07 +0000 2015,300,399,6584,4814,10,,"Activist DC Teacher, WTU Executive Member working to build better lives for students, families, and Teachers in every Ward.  Fighting #BeyondResistance.","Silver Spring, MD",,,,0
16358213,✊#NoodDemocraticSocialistOggy,Noodoggy,Fri Sep 19 02:57:01 +0000 2008,4118,4480,201964,85241,140,,Bentonic #RunBernieRun #Bernie2020 #DemocraticSocialism #NotMeUs #NoMiddleGround,"Greensboro, NC",,,,0
334548525,Yousif Alabbas,darkestbleu,Wed Jul 13 08:23:25 +0000 2011,156,94,590,313,1,,"An Arab-American progressive who 
stands for justice for all. #FeeltheBern #Bernie2020","VA, USA",,,,0
15913565,Kristina 🎉,kristinalustig,Wed Aug 20 03:41:56 +0000 2008,996,537,76,13384,27,,"Feminist + leftist. Amateur creator of pixel art, games, + crosswords. Forever battling boredom. Director of Design @stackoverflow. Opinions are mine. [she/her]","Pittsburgh, PA",,,,0
37861236,Rolando Winborn,landowin,Tue May 05 04:52:16 +0000 2009,203,353,495,442,0,,AKA Ronin The Galactic AKA Tommy Lungs. Emcee. Martial Artist. Creator. Seeker of Truth,"Baltimore, MD",http://t.co/52meQRcLwR,,,0
1109854701271560194,Nashville For Bernie,NashForBernie,Sun Mar 24 16:29:15 +0000 2019,298,480,886,430,1,,"Official twitter for Nashville, TN's chapter of @OFB2020. #Bernie2020 #FeelTheBern #NotMeUs","Nashville, TN",,,,0
772084943698665472,Orlando for Revolution,OrlandoForRev,Sat Sep 03 14:52:50 +0000 2016,324,655,2282,1896,12,,"As a local group of @OurRevolution, we seek to support strong progressive leaders in the Central Florida region.","Orlando, FL",,,,0
1056947179,lucy lucy apple juicy,betterleftcorn,Thu Jan 03 05:18:36 +0000 2013,376,548,15771,11134,35,,"organizer, bravo and doggo lover, @betterleftcast host & executive producer🌹🌽💖  inquiries: corn@betterleft.net","Seattle, WA",https://t.co/1oeit5Tbm9,,,0
16630406,Benjamin Bradlow,bhbradlow,Tue Oct 07 14:34:54 +0000 2008,2133,600,15715,9527,83,,"PhD candidate @BrownSociology. Cities. Democracies. Globalizations. Current research in 🇧🇷 & 🇿🇦. Always comparing.   

Newsletter: https://t.co/2iIingRmB3",Somerville/São Paulo/Joburg,https://t.co/79j5ZUWa8C,,,0
366196796,Thomas Dresslar,Thomas_Dresslar,Thu Sep 01 19:01:13 +0000 2011,465,641,4572,3871,10,,Media relations at @ACLU. On the left. Hails from the real America. Views are my own.,NE ➡️ NYC,,,,0
135250709,Beth Martin,bethkarenmartin,Tue Apr 20 19:31:52 +0000 2010,183,217,2097,172,2,,Research Scientist in the @JShendure lab at @uwgenome,"Bellevue, WA",,,,0
324979744,Imara Crooms,IDCrooms,Mon Jun 27 14:53:45 +0000 2011,255,221,191,105,7,,"World wanderer, recovering techie, perpetual student of #democracy and Resident Program Director for @IRIglobal in #Morocco all opinions are my own.","Rabat, Morocco",,,,0
22084427,rob delaney,robdelaney,Fri Feb 27 00:19:20 +0000 2009,1570624,3063,418590,55129,17191,,🇬🇧UK • Watch all 4 series of #CATASTROPHE on @All4: https://t.co/mJ2KniUbb0 🇺🇸US • Watch it on @PrimeVideo: https://t.co/FrhexBZldI *I don’t often check DMs*,"London, England",https://t.co/ufmjKWRzV0,,,1
2185764440,Reyhaneh ریحانه,Rey_ha_neh,Sun Nov 10 06:36:34 +0000 2013,266,460,814,730,3,,"/The greatest threat is a unified mob/

Writer &  illustrator of Always Not Quite, a graphic memoir on growing up kinda Iranian, kinda American, kinda Muslim.",,https://t.co/SUOvaM7U73,,,0
490517497,Ben Vail,benjaminvail,Sun Feb 12 16:48:37 +0000 2012,107,214,46,90,1,,he/him🏳️‍🌈,"Lebanon, NH",,,,0
12055942,Las Vegas Sun,LasVegasSun,Thu Jan 10 03:04:11 +0000 2008,237014,20796,942,87989,2233,,"Southern Nevada’s award-winning source for news, sports, politics, entertainment and opinion; locally owned and independent since 1950","Las Vegas, NV",http://t.co/Vgbb8zHEUQ,,,1
14868145,People's Action,PplsAction,Thu May 22 13:25:59 +0000 2008,17803,3464,3949,18256,631,,"We are a national grassroots network of more than a million people in 32 states working to promote democracy, social justice, and economic fairness.",The Future,https://t.co/6fELUyHzJd,,,1
19734832,Sarah Kliff,sarahkliff,Thu Jan 29 21:14:18 +0000 2009,136210,1170,4341,20149,3986,,Investigations and health policy for the @nytimes. Got a tip? sarah.kliff@nytimes.com or DM for Signal,"Washington, DC",https://t.co/cAqqxaEO4i,,,1
8953122,PolitiFact,PolitiFact,Tue Sep 18 15:08:32 +0000 2007,637598,8146,2489,40849,11015,,Home of the Truth-O-Meter and independent fact-checking. Part of @Poynter. Sign up for our daily email https://t.co/bfN0WPdGhm.,"Washington, DC",https://t.co/DPzWZ42N71,,,1
19847765,Sahil Kapur,sahilkapur,Sun Feb 01 05:18:57 +0000 2009,125926,578,5118,67865,3192,,National political reporter for Bloomberg News | E-mail me tips at skapur39@bloomberg.net,"Washington, D.C.",https://t.co/HbeX08q5B6,,,1
68611923,Vaughn Hillyard,VaughnHillyard,Tue Aug 25 04:53:55 +0000 2009,33973,4709,5913,19812,937,,"On the Road, Meeting Good Folk | NBC News | Arizonan | IG: https://t.co/JXwBYp6p3P",United States,https://t.co/TouDVeULbs,,,1
16007481,The Greenville News,GreenvilleNews,Wed Aug 27 03:48:22 +0000 2008,91893,815,1582,101497,938,,"The latest news, business and sports from Upstate South Carolina's leading newspaper.","Greenville, S.C.",https://t.co/OcyZcsLeaJ,,,1
435331179,Rashida Tlaib,RashidaTlaib,Mon Dec 12 23:07:37 +0000 2011,554047,2503,8040,10757,2578,,"Unbossed Congresswoman for Michigan's #13districtstrong 

Mama working for justice, social worker at heart, Detroiter, Palestinian American, proud Muslima.","Detroit, MI",https://t.co/1CZT2Ssohc,,,1
1880725393,Sunrise Movement 🌅,sunrisemvmt,Wed Sep 18 20:00:13 +0000 2013,98864,2512,21578,8807,1132,,We are building an army of young people to stop climate change and create millions of good jobs in the process through a #GreenNewDeal.,United States,https://t.co/SHEkMCIfUb,,,1
16637144,Immigration Equality,IEquality,Tue Oct 07 21:12:35 +0000 2008,14917,861,2402,7108,587,,Immigration Equality Action Fund is the nation’s leading LGBTQ immigrant rights organization. We rep & advocate for LGBTQ & HIV-positive immigrants and families,USA,http://t.co/IpVatux1Cv,,,1
793442243734544384,1A,1a,Tue Nov 01 13:19:07 +0000 2016,50321,884,3857,29731,525,,"1A, the news show from @WAMU885 and @NPR, hosted by Joshua Johnson.","Washington, DC",https://t.co/ThNuA1cDJt,,,1
18852393,Kailani Koenig,kailanikm,Sun Jan 11 00:49:42 +0000 2009,11859,2002,3130,21394,532,,Producer with @MSNBC & @NBCNews. #RoadWarriors. Team @MeetThePress alum. 2016 campaign embed. Instagram/Snapchat: kailanikm. Kailani.Koenig@nbcuni.com,"Washington, DC and The Road",https://t.co/ElY00gwnS8,,,1
329115426,Waleed Shahid,_waleedshahid,Mon Jul 04 15:27:30 +0000 2011,69174,1723,14158,10249,632,,"Very Senior Democratic Strategist. Communications Director, @justicedems. Fmr: @AOC, @cynthianixon, @berniesanders [my tweets are my own]",,https://t.co/SO5QLD1eBA,,,1
2269654426,Analilia Mejia,Analilia_Mejia,Wed Jan 08 22:10:14 +0000 2014,7198,673,291,1230,105,,"Mother, JerseyGirl, unrepentant progressive activist and National Political Director for Bernie 2020. Views are my own","Newark, NJ",,,,0
110175724,Carol Burris,carolburris,Sun Jan 31 16:28:41 +0000 2010,10130,355,35,27098,243,,Exec Director of NPE. Retired principal. Author of On the Same Track. Guest blogger for The Answersheet,New York,https://t.co/uciNeg4D8v,,,0
191891492,NEA Education Votes,edvotes,Fri Sep 17 16:42:08 +0000 2010,39865,8767,408,11965,960,,A community of activists founded by the National Education Association focused on building great public schools and benefiting all students.,"Washington, DC",https://t.co/hX9V0b0LEb,,,1
701081673681637376,Jane O'Meara Sanders,janeosanders,Sat Feb 20 16:31:11 +0000 2016,84948,406,780,1439,570,,"Co-Founder of Sanders Institute. Wife, mother, grandmother, public servant. I believe in civil discourse & bold progressive ideas & block hateful posts.","Burlington, VT",https://t.co/TZ2pndR0eG,,,1
25695779,Rex Santus,rexsantus,Sat Mar 21 16:52:08 +0000 2009,3724,883,23548,8376,107,,Reporter @vicenews covering the left + labor. Aging gutter twink. @viceunion thug. Swimmer/cyclist. Not for everyone but def for you. rex.santus@vice.com.,"Brooklyn, NY",https://t.co/pCE20lAu0O,,,1
1121207867611275264,DCFSW National Water for Humanity - Denmark SC,DenmarkWaterCri,Thu Apr 25 00:22:41 +0000 2019,163,181,140,147,1,,"3000 citizens were poisoned for 10 years by DHEC and Elected city officials.  Now, WE FIGHT FOR OUR LIVES!  JOIN OUR FIGHT to access safe clean drinking water.",Denmark South Carolina,,,,0
16513335,VoteVets,votevets,Mon Sep 29 16:00:48 +0000 2008,160506,3628,11156,15451,1549,,"Blocked by @realDonaldTrump. Since 2006, 600K veterans, military families, & supporters have been electing Veterans to office & fighting for progressive values.",United States,https://t.co/7RdMwFqnKv,,,1
761167885720956929,Common Defense,commondefense,Thu Aug 04 11:52:20 +0000 2016,68948,2024,9001,9407,491,,A national grassroots movement of diverse veterans & military families mobilizing against Trump and his dangerous agenda #VetsVsHate #VetsAgainstTrump,,https://t.co/AJbBcaVJxo,,,1
59010637,Diane Ravitch,DianeRavitch,Wed Jul 22 02:42:05 +0000 2009,153284,1677,229,98764,4139,,I write about education. I blog at http://t.co/cigF7OpTYr.,Southold,http://t.co/9Yh2RDylKv,,,0
105082141,EFE Noticias,EFEnoticias,Fri Jan 15 09:04:56 +0000 2010,1525806,66,32,172291,17224,,"Perfil oficial de la Agencia EFE, la primera agencia de noticias en español y la cuarta del mundo. Otros perfiles https://t.co/HcAGHRI7Mp",Madrid,http://t.co/p6IkIc5mKW,,,1
69004966,Matt Pearce 🦅,mattdpearce,Wed Aug 26 15:05:15 +0000 2009,144908,2680,132921,126410,4256,,"National correspondent for the Los Angeles Times, covering 2020. May the forces of evil become confused on the way to your house.",matt.pearce@latimes.com,,,,1
30821435,Annie Leonard,AnnieMLeonard,Mon Apr 13 06:31:11 +0000 2009,10622,888,2334,1662,350,,"Executive Director of @GreenpeaceUSA. Creator of the @StoryOfStuff video, book & org. Waste expert. Book lover. Mom. Seattle native.",California,http://t.co/QimMeNatWZ,,,0
856991073851363328,Pete D'Alessandro,peteforiowa,Tue Apr 25 21:59:28 +0000 2017,2420,1055,418,528,60,,American. Progressive. Democrat. Raider Nation. In that order.,"Des Moines, IA",https://t.co/vvpWJhaDeX,,,0
15191919,Josh Orton,joshorton,Sat Jun 21 19:11:09 +0000 2008,8016,1181,580,8241,202,,Senior Advisor and Policy Director for Bernie. This is the internet.,"Madison, WI and Washington, DC",,,,1
1885166622,Briana Blueitt,briana_blue,Fri Sep 20 03:17:36 +0000 2013,719,911,2406,1154,10,,comms for #Bernie2020 ⋆ texas native ⋆ formerly digital @SolidarityLLC ⋆ opinions are my own,,,,,0
2829987121,Alex Jacquez,AlexSJacquez,Wed Sep 24 14:08:44 +0000 2014,561,578,2245,246,14,,"Policy Advisor @berniesanders. Previously @senatedems, @obamawhitehouse, @usda. Washed up @lehighbaseball. Proud union man @ufcw. Tweets=mine.","Washington, DC",,,,0
14855994,David Sirota,davidsirota,Wed May 21 12:59:37 +0000 2008,135551,2730,5781,2136,3634,,Now: @BernieSanders’ speechwriter/@TheGoldbergsABC guy/@EmilyforCO spouse. Past: Loeb finalist/SPJ/SABEW-winning journo at @Newsweek @CapitalandMain @GuardianUS,The 1980s,https://t.co/a6ZaEcoQhx,,,1
93330058,Joe Calvello,the_vello,Sun Nov 29 05:01:27 +0000 2009,1237,1468,13386,652,35,,Western Press Secretary @Berniesanders | @UFCW Local 400 member | Formerly  @keithellison @ellisoncampaign |,"Washington, DC",,,,0
480926084,Minnesota for Bernie,BerningMinn,Thu Feb 02 02:48:28 +0000 2012,3066,2778,1,3341,31,,"Our government will be based on justice. Economic Justice, Social Justice, Racial Justice and Environmental Justice!
Bernie Sanders #Bernie2020 #NoMiddleGround",United States,,,,0
417357386,UChicago GSU,uchicagogsu,Sun Nov 20 20:49:26 +0000 2011,4293,1890,7349,8534,60,,"Graduate Students United at the University of Chicago: fighting for better working & study conditions since 2007. Affiliate of @AFTunion, @iftaft, @AAUP #YesGSU","Chicago, IL 60637",https://t.co/mTu7vOuOVA,,,0
14296273,Common Dreams,commondreams,Thu Apr 03 19:54:13 +0000 2008,63817,2034,259,47459,2874,,Breaking News & Views for the Progressive Community,"Portland, ME, USA",http://t.co/jPvkcfqiXi,,,0
15896580,Aamer Madhani,AamerISmad,Mon Aug 18 21:26:08 +0000 2008,5171,4510,1740,1580,290,,national political reporter for @USATODAY. Chicago resident. https://t.co/Tva3vtj5dJ amadhani@usatoday.com,,https://t.co/iJnt4doh6o,,,1
201864200,United for Respect,forrespect,Tue Oct 12 20:02:03 +0000 2010,8472,1312,0,9267,195,,We are a movement of working people fighting for an economy that allows us to live & work in dignity. Legal Notice: https://t.co/FArwn9WzjR,,https://t.co/0gjhQ3FfkR,,,0
16930125,Ed O'Keefe,edokeefe,Thu Oct 23 16:47:50 +0000 2008,81507,19666,10470,51146,2673,,@CBSNews political correspondent covering #Campaign2020. Proudly #Irish and #Latino. @AmericanU & @washingtonpost alum. @NAHJ. ed.okeefe@cbsnews.com.,"Washington, D.C.",https://t.co/gbwmpTItek,,,1
448201718,Belén Sisa,belensisaw,Tue Dec 27 18:47:40 +0000 2011,7643,1959,10456,4837,103,,#UndocumentedUnafraid | Latino Press Sec for @BernieSanders 2020 | #Bernie2016 alum | co-founder of @USEEASU | member of the #Dream7 ✊🏽| opinions are my own,"Washington, DC",https://t.co/dadmhXqHSN,,,0
4559408663,Armand Aviram,armandaviram,Mon Dec 21 18:06:11 +0000 2015,2990,732,2813,1174,67,,senior media producer for @berniesanders. former politics producer at @nowthisnews. before that I taught music and played in a band.,"Washington, DC",https://t.co/4MHdXXVJLg,,,0
312382472,Adam Kelsey,adamkelsey,Tue Jun 07 01:35:19 +0000 2011,2345,978,1613,7823,88,,"@ABC News campaign reporter by day | @Capitals in-game host by night | Stops along the way at @columbiajourn, @GWtweets & @TeachForAmerica","Washington, DC",https://t.co/OyRslFxvgC,,,1
843260520429993985,Political Party LIVE!,PPLiveIowa,Sun Mar 19 00:39:09 +0000 2017,744,401,2599,2204,5,,Millennial-run podcast + live events across Iowa designed to engage and elevate the next generation of progressive leaders | RTs ≠ endorsements 🎙🇺🇸👏,"Iowa, USA",https://t.co/eqpGW70S7B,,,0
1584014898,Maayan Schechter,MaayanSchechter,Wed Jul 10 21:12:48 +0000 2013,3518,2037,5891,21385,107,,"(My-yahn Schek-ter) מַעֲיָן | SC Statehouse reporter w/ @thestate | Fmr @aikenstandard, @GreenvilleNews | @UNCAVL grad | ATL native",,,,,1
54322823,Eric Bradner,ericbradner,Mon Jul 06 20:30:23 +0000 2009,20107,4673,8264,17970,834,,"National political reporter for @CNN covering 2020. Also here for the Cubs, the NBA, drafts, sneakers and #L1C4. eric.bradner@cnn.com.",Chicago or on the trail,https://t.co/LskMZsHGEp,,,1
2339574482,Oliver Hidalgo-Wohlleben,OliverHidWoh,Wed Feb 12 02:00:28 +0000 2014,6107,2051,10790,2620,12,,"Director of Latinx Outreach for @BernieSanders. Activist, art buff, occasional runner. Former Partner @WeAreSoze + Ladis Kristof Fellow at @Amnesty. 📍IA","Des Moines, IA",https://t.co/nuBuflYjUL,,,0
8839632,NBC Nightly News with Lester Holt,NBCNightlyNews,Wed Sep 12 19:19:22 +0000 2007,976109,478,1714,132466,11011,,"Breaking news, in-depth reporting, context on news from around the world | Full episodes: https://t.co/xfi4YbHh0x | Newsletter: https://t.co/ACxkqB0LFh",New York,https://t.co/siVgviWIA1,,,1
794651044450041856,NDRC,DemRedistrict,Fri Nov 04 21:22:27 +0000 2016,33426,48,546,1593,374,,Gerrymandering is a threat to our democracy. The National Democratic Redistricting Committee (NDRC) is fighting for #fairmaps in the 2021 redistricting process.,,https://t.co/UbdVHIF27p,,,1
21862217,Krystal Ball,krystalball,Wed Feb 25 12:58:53 +0000 2009,158294,4280,1596,21709,2194,,"co-host Rising @hilltvlive Reversing the Apocalypse. Ella, Lolo and Ida Rose's mama!","King George, VA",https://t.co/edcDtPRvXH,,,1
394101339,Gary Grumbach,GaryGrumbach,Wed Oct 19 15:35:09 +0000 2011,4562,4147,17389,15657,143,,2020 campaign embed @NBCNews. Always curious. Always eating rice cakes. @elonuniversity grad. Follow my travels: #GaryOnTheGround,DC now/NJ then,https://t.co/wCzmQYuB2I,,,1
77347110,Tara Golshan,taragolshan,Sat Sep 26 00:07:49 +0000 2009,9468,2369,1968,6680,330,,Congress/2020 reporter @voxdotcom. @BadgerHerald and @UWMadison alum. Supporter of @vox_union. Sometimes found practicing my Elaine Benes dance.,"Washington DC via Madison, WI via California",,,,1
263473924,Elizabeth Landers,ElizLanders,Thu Mar 10 03:15:18 +0000 2011,42891,1735,19606,23309,986,,"DC correspondent, @ViceNews Tonight on HBO. survived the Bernie/@VP campaign trail. Alum of @cnn, @tuftsuniversity. Tallahassee native. fashion fan.","Washington, DC",https://t.co/ev1Kmmquwz,,,1
22524908,Ron T. Kim,rontkim,Mon Mar 02 15:38:51 +0000 2009,10287,2096,7093,2934,193,,NY lawmaker dedicated to ending corporate giveaways💰 cancelling #studentdebt ✊🏽 busting up #BigTech 💻 putting #PeopleOverCorporations 💪🏼,"Flushing, NY",https://t.co/Z7vwfx6cXL,,,1
473513339,Rafael L Espinal Jr.,RLEspinal,Wed Jan 25 02:02:10 +0000 2012,9698,1601,7902,3233,211,,"Brooklyn, NYC Council Member. Cabaret Law repealer, fighting plastic pollution & climate crisis 🍃 for food justice & a livable city for all",Brooklyn,https://t.co/9aujf6pnyn,,,1
337325417,Julia Salazar,JuliaCarmel__,Sun Jul 17 21:04:53 +0000 2011,28026,1865,26523,2295,338,,"State Senator for NY’s 18th District, Brooklyn. Chair of @NYSenate’s Women’s Issues Committee. Tenant, organizer, & tenant organizer. info@salazarforsenate.com","Bushwick, Brooklyn",,,,1
1035912728504938497,Eric Blanc,_ericblanc,Sat Sep 01 15:30:15 +0000 2018,2665,507,1852,630,24,,"Author of ""Red State Revolt: The Teachers' Strike Wave & Working-Class Politics"" https://t.co/B2yMAwWbwA","New York, NY",https://t.co/uwNRGmvyZy,,,0
3226503792,Michael Fasullo,MeetMichael_,Mon May 25 20:59:02 +0000 2015,1141,712,5952,2863,17,,Organizing for @BernieSanders in IA,"Des Moines, IA",,,,0
